work_id,title,author,rating,category,fandom,relationship,character,additional tags,language,published,status,status date,words,chapters,comments,kudos,bookmarks,hits,all_kudos,all_bookmarks,all_comments,body
24175576,Room Parties and Banquets,['Zahri'],General Audiences,Gen,Yuri!!! on Ice (Anime),Katsuki Yuuri/Victor Nikiforov,"Katsuki Yuuri, Victor Nikiforov, Mila Babicheva, Yuri Plisetsky, Phichit Chulanont, Leo de la Iglesia, Michele Crispino, Sara Crispino, Christophe Giacometti","Headcanon, Meta",English,14/5/20,Completed,14/5/20,1134,1-Jan,14,89,8,560,"['Lookingkindofdumb', 'order_of_chaos', 'm1yakiy0omi', 'Claudia2354S', 'elloren', 'Dhaskoi', 'TheQueenoftheAbyss', 'forever_bibliophile', 'queerenteen', 'sea0fseren1ty', 'AKingFisher', 'Ckristina', 'Weezie_B', 'eunoiapaint', 'NikSofia21', 'riinflorida', 'Petrina_Van_Jay', 'FandomTrashTM', 'PheonixShadow', 'BeauBennett', 'mopi92', 'kpop_Itsgreat963', 'hny25299', 'aislinngun', 'Fossore', 'CounterFlipper', 'sarahmacht', 'Elenca', 'driedlasagna', 'Luhtavilla', 'crystal_violet', 'afieldofsuns', 'surreal_eyes', 'bmeduho', 'Crystara', 'Imonherewaytooften', 'melinyel', 'eiua', 'DragonTamerEmi', 'Inknpaperlove', 'OnlySatanCanLoveaMessLikeMe', 'tootles444', 'WhyArentMyFriendsLikeMe', 'AsthraPolaris', 'Moonclaimed', 'tsukking', 'nobodysspecial', 'toxyjin', 'xXKareBearXx', 'PottersLoveRedheads', 'Lookingkindofdumb', 'order_of_chaos', 'm1yakiy0omi', 'Claudia2354S', 'elloren', 'Dhaskoi', 'TheQueenoftheAbyss', 'forever_bibliophile', 'queerenteen', 'sea0fseren1ty', 'AKingFisher', 'Ckristina', 'Weezie_B', 'eunoiapaint', 'NikSofia21', 'riinflorida', 'Petrina_Van_Jay', 'FandomTrashTM', 'PheonixShadow', 'BeauBennett', 'mopi92', 'kpop_Itsgreat963', 'hny25299', 'aislinngun', 'Fossore', 'CounterFlipper', 'sarahmacht', 'Elenca', 'driedlasagna', 'Luhtavilla', 'crystal_violet', 'afieldofsuns', 'surreal_eyes', 'bmeduho', 'Crystara', 'Imonherewaytooften', 'melinyel', 'eiua', 'DragonTamerEmi', 'Inknpaperlove', 'OnlySatanCanLoveaMessLikeMe', 'tootles444', 'WhyArentMyFriendsLikeMe', 'AsthraPolaris', 'Moonclaimed', 'tsukking', 'nobodysspecial', 'toxyjin', 'xXKareBearXx', 'PottersLoveRedheads']","[{'username': 'Lookingkindofdumb', 'date': '12 May 2021', 'tags': [], 'collections': None, 'summary': None}, {'username': 'DiamondRose48', 'date': '25 Apr 2021', 'tags': [], 'collections': None, 'summary': None}, {'username': 'm1yakiy0omi', 'date': '19 Apr 2021', 'tags': [], 'collections': None, 'summary': None}, {'username': 'forever_bibliophile', 'date': '23 Jan 2021', 'tags': [], 'collections': None, 'summary': None}, {'username': 'contrarynondairy', 'date': '01 Jan 2021', 'tags': [], 'collections': None, 'summary': None}, {'username': 'riinflorida', 'date': '14 Dec 2020', 'tags': [], 'collections': None, 'summary': None}, {'username': 'melinyel', 'date': '04 Oct 2020', 'tags': ['outside'], 'collections': None, 'summary': ['https://archiveofourown.org/works/24175576']}, {'username': 'gjapples', 'date': '14 May 2020', 'tags': [], 'collections': None, 'summary': None}]","[{'user': 'AFeatheredRiddle', 'datetime': {'day': 'Thu', 'date': '14', 'month': 'May', 'year': '2020', 'time': '01:42PM', 'timezone': 'KST'}, 'id': '305086624', 'parent': True, 'text': 'I really enjoyed this!', 'reply': [{'user': 'Zahri', 'datetime': {'day': 'Thu', 'date': '14', 'month': 'May', 'year': '2020', 'time': '02:50PM', 'timezone': 'KST'}, 'id': '305102314', 'parent': False, 'text': 'Thank you!'}]}, {'user': 'afieldofsuns', 'datetime': {'day': 'Fri', 'date': '09', 'month': 'Oct', 'year': '2020', 'time': '03:50PM', 'timezone': 'KST'}, 'id': '352259422', 'parent': True, 'text': 'omg bless!!! I love these predictions so much!!!'}, [{'user': 'Zahri', 'datetime': {'day': 'Fri', 'date': '09', 'month': 'Oct', 'year': '2020', 'time': '07:34PM', 'timezone': 'KST'}, 'id': '352290463', 'parent': False, 'text': 'Thank you!'}], {'user': 'Elenca', 'datetime': {'day': 'Fri', 'date': '16', 'month': 'Oct', 'year': '2020', 'time': '07:58AM', 'timezone': 'KST'}, 'id': '354360217', 'parent': True, 'text': 'This is absolutely delightful ❤️❤️❤️', 'reply': [{'user': 'Zahri', 'datetime': {'day': 'Fri', 'date': '16', 'month': 'Oct', 'year': '2020', 'time': '08:09AM', 'timezone': 'KST'}, 'id': '354362794', 'parent': False, 'text': 'Thank you!\nEuropeans is everyone excited to see Yuuri and the softening effect he has on Victor.\n4 Continents is just all these skaters who have never been to a comp with '}, {'user': 'Elenca', 'datetime': {'day': 'Fri', 'date': '16', 'month': 'Oct', 'year': '2020', 'time': '08:44AM', 'timezone': 'KST'}, 'id': '354370387', 'parent': False, 'text': 'The juxtaposition of the two is part of what makes it so great. Also, 4CC Vitya is an accurate old person mood™️ and I love and support him for it lol'}, {'user': 'Zahri', 'datetime': {'day': 'Fri', 'date': '16', 'month': 'Oct', 'year': '2020', 'time': '08:56AM', 'timezone': 'KST'}, 'id': '354373267', 'parent': False, 'text': 'Old person mood is real!\n(I also, at travel sports competitions when I was Victor’s age wanted to have conversations with some Actual Adults, because as much as I loved my 18-21 year old teammates they were babies with different concerns)'}, {'user': 'Elenca', 'datetime': {'day': 'Fri', 'date': '16', 'month': 'Oct', 'year': '2020', 'time': '11:06AM', 'timezone': 'KST'}, 'id': '354403219', 'parent': False, 'text': 'Right!!! I’m 34 and while I adore Phichit and love his vivacity in the series and in so many stories, dear god that child would knock me flat on my exhausted ass so fast 😂'}, {'user': 'Zahri', 'datetime': {'day': 'Fri', 'date': '16', 'month': 'Oct', 'year': '2020', 'time': '11:51AM', 'timezone': 'KST'}, 'id': '354414676', 'parent': False, 'text': '...yup. 1000%.\nHe’s very well characterised! I also would be like ‘there is a phone ban during training for a REASON, if you can’t comply the phone goes in my pocket’. That Cup of China photo - he obviously should have known better than to post that one publicly.\n(Also I quietly object to the level of training videos that he puts up in some fics, because yeah no closed practices are closed for a reason, no spoilers kid, but I realise it’s usually to drive the plot. But Yuuri and Victor would be the last people alive to allow people to post sneak peak new skill vids - Yuuri because he’d not be confident that he could follow through at comp, and Victor because ✨surprises✨)'}, {'user': 'Elenca', 'datetime': {'day': 'Fri', 'date': '16', 'month': 'Oct', 'year': '2020', 'time': '12:58PM', 'timezone': 'KST'}, 'id': '354430453', 'parent': False, 'text': 'It’s so so so true. All of this. Him characterized with chaotic good/neutral 20s energy would be terrifying in reality, but damn am I sucker for “Phichit, no,” “Phichit, yes!” energy as a fictional idea 😂❤️\nBut seriously!! They WOULD NEVER share their secrets, be they plans for surprises or their dark present. Celestino would probably drill the importance of keeping those things under wraps for their own careers’ sake anyway, to not tip one’s hand before it’s necessary to the competition. And playfulness aside, Phichit wanted that gold just as much as the rest of them. He cares a lot about his image and his brand and inspiring a new generation of Thai skaters and SNS in general, but he also takes his skating pretty damn seriously to make it to the final.\nBut also, damn son, Yuuri’s coach was smooching him naked. In public. Sure, there’s not homophobia to deal with in YOI BUT THAT IS STILL A BIT MMMMM QUESTIONABLE PROFESSIONALLY. I do wonder by then what level of potential romance teasing had been done yet, intentionally or not, by Vitya and the triplets’ accounts, so maybe there was some positive ripples about the idea of them...? But that’s still!!!'}, {'user': 'Zahri', 'datetime': {'day': 'Fri', 'date': '16', 'month': 'Oct', 'year': '2020', 'time': '01:51PM', 'timezone': 'KST'}, 'id': '354442084', 'parent': False, 'text': 'Yeah! I realise in my case it’s more than 2 decades of sport (coaching and competing) and signing social media policies and dealing with the real world side of these things showing through, but sometimes the way people have them act when as characters they KNOW things are in the media just seems ridiculous. Phichit isn’t going to orchestrate the entire Victuuri fandom online. He’s got too much of his own going on. He’s going to tease his friend in private messages and (from the show) make some suspicious public posts he probably shouldn’t.\nAnd oh god, coach/athlete stuff. Yeah. Just... yeah. That’s ‘whispers’ stuff and PROFESSIONALISM CALLED INTO QUESTION. \nDo you mind if we take this somewhere else? I’m having a good discussion but obviously this is an awkward method!'}]}, [{'user': 'Zahri', 'datetime': {'day': 'Tue', 'date': '15', 'month': 'Dec', 'year': '2020', 'time': '05:43AM', 'timezone': 'KST'}, 'id': '372163257', 'parent': False, 'text': 'He’s just so loveable ❤️ (And whispering dirty things in Victor’s ear as he is DRUNK). Victor never realised how much more fun this is than 5 years of straight gold until it became his life.'}]]","The first time Yuuri goes to Europeans with Victor, he spends the banquet getting ALL the room party invites. Because Yuuri's traditionally known at Worlds for going to whatever room party Phichit is at, and hanging out with other Asian skaters or various standbys of the American community. If he's spending time with any of the Europeans, it's like the Crispinos and/or Chris, because everyone knows they've all been friends/rivals since Juniors.

(Everyone knows that Mickey is STILL MAD that Sara's first year in Seniors was the same one as Yuuri's, while Mickey was still stuck in Juniors. Mickey wasn't allowed to go along to some of her events and Sara came home from one of them with stories of Yuuri deathglaring another skater who was rude to Sara. Yuuri had in fact been feeling awkward and younger than all the other men and had come over to Sara to chat as she was at least familiar, but the Yuuri Game Face as he pulled the confidence together to come say hi scared the dickhead off. This is one of the main sources of Mickey's public dislike of Yuuri and conviction that he's out to seduce Sara, along with their Challenger Series results)

The not-quite-top-tier Euro skaters are just so EXCITED to see Yuuri here. He doesn't slot into the standard politics of who gets an invite to which room party at Europeans! They get to see one of the best non-Euro skaters let their hair down (because they've SEEN Phichit's skaters-only snapchats from 4CC)! He might convince Victor to actually come out and party! (Victor is known for making an appearance at either: the Russian party, where he sits in a corner chatting casually to whoever comes over, and bails out his younger rinkmates when they need to get to bed/not embarrass themselves; or whichever one Chris is at, where they dance together beautifully. There are always a lot of ice dancers at the second option and the party is as much about showing off dance moves as it is getting seriously hammered on hard alcohol. At both types of party, Victor has this unapproachable aura that prevents everyone who hasn't known him forever from coming over)

So Yuuri has all these invites, to basically all the athlete parties, and he's asking Victor which ones they should go to, and Victor's like ""IDK, you decide, they're asking you, Yuuri, I'll come with you wherever"", so now Mila is hanging over his shoulder giving her two bobs worth about where they should go, and who'll have the best music, and what alcohol's likely on offer.

So they end up dropping in on at least three different parties, and Yuuri dances with Victor at each one, and half of the other skaters at Europeans are just outright amazed, because how is this Victor Nikiforov? He's out drinking! Looking sappily in love! Arguing about choreography with some of the older pairs couples! Dancing silly dances with his fiance! Yuuri Katsuki is indeed a god and a miracle worker.

(Yuri uses the fact Victor is busy escorting Yuuri around all the parties and enjoying people fawning over Yuuri to sneak off to one of the young ones' parties that involves a lot of heavy metal music and underage drinking. Victor's too distracted to do his normal Big Brother To All Rinkmates act where he'll let you party and even drink a bit, but swoops in to cut you off as soon as the fun looks like it's turned the corner).

At Victor's first trip to Four Continents with Yuuri, the banquet consists of a lot of athletes staring at Victor, then turning to Yuuri and begging ""Please please bring Victor to our room party"". None of the younger ones will talk to him personally.

Phichit just laughs at Yuuri a lot. Yuuri is trying to die of embarrassment.

The older population of... let's say Gadbois? Somewhere with a lot of older pairs and ice dancers, anyway, swoop in and kidnap Victor for most of the banquet because they want to hang out with another Adult, not the babies, my god the 15 year olds are such fetuses these days, and chatting to Victor is a nice change. They all know each other well enough from years of ice shows and Worlds, and people want to pick Victor's brain about how it feels to transition into coaching and choreography. Victor knows he should be networking with sponsors for Yuuri, but he doesn't know those present here nearly as well and the JSF seem to have that under control, so he happily goes off to talk to people who don't treat him like he's an untouchable deity.

Afterwards, they drop in at the major Asian afterparty, where all the Japanese Ladies take turns dancing with Yuuri in between shots. Victor's a bit confused. At Four Continents, apparently getting gold basically just means everyone else gets to demand forfeits from you, so everyone's daring Yuuri to do a lot of silly things, which Yuuri goes along with cheerfully. This doesn't happen at Europeans, largely because Victor's had a lock on it for so long.

Leo, who's feeling his 4th place finish hard, ends up in a spirited debate with Phichit over whether or not Victor has to wear a stupid hat at the party because while he can't compete at Four Continents, he's Freaking Victor Nikiforov, Olympic gold medals definitely still count.

Once Yuuri's satisfied everyone, Yuuri smiles that sappy smile at Victor that Victor loves, presses his whole body against Victor as he stands on tiptoes and whispers into Victor's ear, and breathes ""You want to go spend more time with the Canadians, don't you?"" Victor nods, dazed, because drunk Yuuri does things to him, but also he'd rather spend the rest of the evening with adults over 25 if Yuuri is just going to keep getting pulled away from him all night. Not that he doesn't enjoy watching Yuuri - he's VICTOR of course he does - but his only responsibilities at Four Continents are coaching, and that's now done with, so he might as well get a chance to relax around people who don't think of him as a god.

So they head off together to one of the adults room parties that Yuuri's never been to, because he's usually hanging out with the younger crowd and singles skaters, and find themselves waltzing together staring into each other's eyes and getting significantly more drunk as they don't have to worry about being a Good Example for the young ones.

Both Victor and Yuuri agree that Europeans and Four Continents were far more fun than usual. The rest of the skating community agrees that they're the cutest pair ever because they've made each other far more entertaining."